show, panel, gram, gram_canonical
yes, fields, conservation, conservation 
yes, fields, natural history, natural history 
yes, fields, preservation, preservation 
yes, fields, ecology, ecology
yes, movements, preservationist, preservationist 
yes, movements, environmentalist, environmentalist 
yes, movements, naturalist, naturalist 
yes, movements, conservationist, conservationist 
yes, movements, ecologist, ecologist
yes, management, preserve, preserve 
yes, management, reserve, reserve 
yes, management, parks, parks 
yes, management, protected area, protected area
yes, re-emerging, restoration, restoration 
yes, re-emerging, refugia, refugia 
yes, re-emerging, valuation, valuation 
yes, re-emerging, biodiversity, biodiversity
